{
  "family": "type-scale",
  "version": "1.0.0",
  "governing_fact": "Every Tesserine surface is a typeset record: the quiet, documentary projection of a machine-readable artifact that remains the product. (design/v1/SYSTEM.md)",
  "base": "1rem",
  "ratio": 1.25,
  "members": [
    {
      "id": "type.display",
      "power": 4,
      "size": "2.441rem",
      "line_height": 1.15,
      "role": "the surface's identity line, masthead only",
      "derivation": "Entailment 2 (one rhythm, one ratio): the scale's top, 1.25^4 — the record's name outranks everything on the surface and nothing outranks it; leading tightest because an identity line is read as a mark, not a passage."
    },
    {
      "id": "type.title",
      "power": 3,
      "size": "1.953rem",
      "line_height": 1.2,
      "role": "an entry's title",
      "derivation": "Entailment 2 (one rhythm, one ratio): 1.25^3 — the first level of the record's interior structure, one ratio step below the identity it belongs to."
    },
    {
      "id": "type.heading",
      "power": 2,
      "size": "1.563rem",
      "line_height": 1.3,
      "role": "a heading within an entry",
      "derivation": "Entailment 2 (one rhythm, one ratio): 1.25^2 — the second interior level, ranked by the same ratio; a record's structure descends evenly or it is not measured."
    },
    {
      "id": "type.subhead",
      "power": 1,
      "size": "1.25rem",
      "line_height": 1.4,
      "role": "a minor subhead or the lede's standfirst",
      "derivation": "Entailment 2 (one rhythm, one ratio): 1.25^1 — the last rank above running matter, where the record's summary and minor groupings sit, one step off the reading base."
    },
    {
      "id": "type.body",
      "power": 0,
      "size": "1rem",
      "line_height": 1.5,
      "role": "running text",
      "derivation": "Entailment 2 (one rhythm, one ratio): the base itself — the record is read at length, so the whole scale is anchored on the reading size, and its 1.5 leading defines the rhythm line every space token is named from."
    },
    {
      "id": "type.caption",
      "power": -1,
      "size": "0.8rem",
      "line_height": 1.5,
      "role": "metadata, captions, provenance, evidence data",
      "derivation": "Entailment 2 (one rhythm, one ratio): 1.25^-1 — the one step below reading size, for the record's caption-grade matter; it keeps the full reading leading because provenance is still read, not skimmed."
    }
  ]
}
